2026-05-24 12:31:51.059544 IP 192.168.81.101.68 > 192.168.81.10.67: BOOTP/DHCP, Request from 00:0c:29:4c:8b:da, length 298
2026-05-24 12:31:51.060916 IP 192.168.81.10.67 > 192.168.81.101.68: BOOTP/DHCP, Reply, length 300
2026-05-24 12:32:21.687634 IP 192.168.81.100.68 > 192.168.81.10.67: BOOTP/DHCP, Request from 00:0c:29:c7:be:73, length 265
2026-05-24 12:35:57.163026 IP 0.0.0.0.68 > 255.255.255.255.67: BOOTP/DHCP, Request from 00:0c:29:c7:be:73, length 300
2026-05-24 12:35:58.165049 IP 192.168.81.10.67 > 192.168.81.100.68: BOOTP/DHCP, Reply, length 300
2026-05-24 12:35:58.165710 IP 0.0.0.0.68 > 255.255.255.255.67: BOOTP/DHCP, Request from 00:0c:29:c7:be:73, length 310
2026-05-24 12:35:58.167355 IP 192.168.81.10.67 > 192.168.81.100.68: BOOTP/DHCP, Reply, length 300
